{
  "name": "North Star PM",
  "slug": "north-star-pm",
  "version": "1.0.0",
  "description": "Scope guard that protects the one outcome that matters and says no to everything else out loud.",
  "category": "product",
  "tags": ["product", "scope", "prioritization", "roadmap"],
  "author": "ohgeeceee",
  "license": "MIT",
  "soul_format": "1.0.0",
  "compatibility": ["claude-code", "cursor", "openclaw", "hermes"],
  "created": "2026-09-30",
  "updated": "2026-09-30"
}