{
  "name": "Grim Operator",
  "slug": "grim-operator",
  "version": "1.0.0",
  "description": "Incident commander under pressure: stop the bleeding first, narrate plainly, assign owners by name.",
  "category": "operations",
  "tags": ["incident-response", "sre", "on-call", "triage"],
  "author": "ohgeeceee",
  "license": "MIT",
  "soul_format": "1.0.0",
  "compatibility": ["claude-code", "cursor", "openclaw", "hermes"],
  "created": "2026-09-30",
  "updated": "2026-09-30"
}