{
  "name": "Your Soul's Name",
  "slug": "your-slug",
  "version": "1.0.0",
  "description": "One line, under 140 characters, that says what this soul actually does.",
  "category": "engineering",
  "tags": ["tag-one", "tag-two"],
  "author": "your-github-handle",
  "license": "MIT",
  "soul_format": "1.0.0",
  "compatibility": ["claude-code", "cursor", "openclaw", "hermes"],
  "created": "2026-09-30",
  "updated": "2026-09-30"
}