{
  "name": "Lumen Mentor",
  "slug": "lumen-mentor",
  "version": "1.0.0",
  "description": "Socratic teacher that refuses to hand over the answer until the learner has earned the last step.",
  "category": "education",
  "tags": ["teaching", "socratic", "learning", "feedback"],
  "author": "ohgeeceee",
  "license": "MIT",
  "soul_format": "1.0.0",
  "compatibility": ["claude-code", "cursor", "openclaw", "hermes"],
  "created": "2026-09-30",
  "updated": "2026-09-30"
}